SHELL# mikanectl hash bpftoolcli -t 17 -b fc00:11:1::00  | sudo sh -xe    // <-- set n1 is backend
SHELL# docker exec -it CLOS tcpdump -nni any not icmp6 and not tcp port 179
(START NETCAT1)
===

12:24:19.117265 hv1   In  IP6 fc00:201:: > fc00:1:1::: RT6 (len=2, type=4, segleft=0, last-entry=0, tag=0, [0]fc00:1:1::) IP 10.254.0.10.54676 > 10.255.100.1.7777: Flags [P.], seq 360518314:360518329, ack 3696981341, 
12:24:19.117281 l1    Out IP6 fc00:201:: > fc00:1:1::: RT6 (len=2, type=4, segleft=0, last-entry=0, tag=0, [0]fc00:1:1::) IP 10.254.0.10.54676 > 10.255.100.1.7777: Flags [P.], seq 0:15, ack 1, 
12:24:19.117312 l1    In  IP6 fc00:1:: > fc00:11:1::: RT6 (len=2, type=4, segleft=0, last-entry=0, tag=0, [0]fc00:11:1::) IP 10.254.0.10.54676 > 10.255.100.1.7777: Flags [P.], seq 0:15, ack 1, 
12:24:19.117318 n1    Out IP6 fc00:1:: > fc00:11:1::: RT6 (len=2, type=4, segleft=0, last-entry=0, tag=0, [0]fc00:11:1::) IP 10.254.0.10.54676 > 10.255.100.1.7777: Flags [P.], seq 0:15, ack 1, 
12:24:19.117352 n1    In  IP 10.254.0.10.54676 > 10.255.100.1.7777: Flags [P.], seq 0:15, ack 1, 
12:24:19.117360 c1    Out IP 10.254.0.10.54676 > 10.255.100.1.7777: Flags [P.], seq 0:15, ack 1, 

12:24:19.117371 c1    In  IP 10.255.100.1.7777 > 10.254.0.10.54676: Flags [.], ack 15, 
12:24:19.117384 l1    Out IP 10.255.100.1.7777 > 10.254.0.10.54676: Flags [.], ack 15, 
12:24:19.117393 l1    In  IP6 fc00:1:: > fc00:11:1::: RT6 (len=2, type=4, segleft=0, last-entry=0, tag=0, [0]fc00:11:1::) IP 10.255.100.1.7777 > 10.254.0.10.54676: Flags [.], ack 15, 
12:24:19.117396 n1    Out IP6 fc00:1:: > fc00:11:1::: RT6 (len=2, type=4, segleft=0, last-entry=0, tag=0, [0]fc00:11:1::) IP 10.255.100.1.7777 > 10.254.0.10.54676: Flags [.], ack 15, 
12:24:19.117407 n1    In  IP6 fc00:11:: > fc00:201:1::: RT6 (len=2, type=4, segleft=0, last-entry=0, tag=0, [0]fc00:201:1::) IP 10.255.100.1.7777 > 10.254.0.10.54676: Flags [.], ack 15, 
12:24:19.117411 hv1   Out IP6 fc00:11:: > fc00:201:1::: RT6 (len=2, type=4, segleft=0, last-entry=0, tag=0, [0]fc00:201:1::) IP 10.255.100.1.7777 > 10.254.0.10.54676: Flags [.], ack 15, 

12:24:23.330987 hv1   In  IP6 fc00:201:: > fc00:1:1::: RT6 (len=2, type=4, segleft=0, last-entry=0, tag=0, [0]fc00:1:1::) IP 10.254.0.10.54676 > 10.255.100.1.7777: Flags [P.], seq 15:31, ack 1, 
12:24:23.331002 l1    Out IP6 fc00:201:: > fc00:1:1::: RT6 (len=2, type=4, segleft=0, last-entry=0, tag=0, [0]fc00:1:1::) IP 10.254.0.10.54676 > 10.255.100.1.7777: Flags [P.], seq 15:31, ack 1, 
12:24:23.331032 l1    In  IP6 fc00:1:: > fc00:11:1::: RT6 (len=2, type=4, segleft=0, last-entry=0, tag=0, [0]fc00:11:1::) IP 10.254.0.10.54676 > 10.255.100.1.7777: Flags [P.], seq 15:31, ack 1, 
12:24:23.331037 n1    Out IP6 fc00:1:: > fc00:11:1::: RT6 (len=2, type=4, segleft=0, last-entry=0, tag=0, [0]fc00:11:1::) IP 10.254.0.10.54676 > 10.255.100.1.7777: Flags [P.], seq 15:31, ack 1, 
12:24:23.331072 n1    In  IP 10.254.0.10.54676 > 10.255.100.1.7777: Flags [P.], seq 15:31, ack 1, 
12:24:23.331080 c1    Out IP 10.254.0.10.54676 > 10.255.100.1.7777: Flags [P.], seq 15:31, ack 1, 

12:24:23.331092 c1    In  IP 10.255.100.1.7777 > 10.254.0.10.54676: Flags [.], ack 31, 
12:24:23.331099 l1    Out IP 10.255.100.1.7777 > 10.254.0.10.54676: Flags [.], ack 31, 
12:24:23.331113 l1    In  IP6 fc00:1:: > fc00:11:1::: RT6 (len=2, type=4, segleft=0, last-entry=0, tag=0, [0]fc00:11:1::) IP 10.255.100.1.7777 > 10.254.0.10.54676: Flags [.], ack 31, 
12:24:23.331116 n1    Out IP6 fc00:1:: > fc00:11:1::: RT6 (len=2, type=4, segleft=0, last-entry=0, tag=0, [0]fc00:11:1::) IP 10.255.100.1.7777 > 10.254.0.10.54676: Flags [.], ack 31, 
12:24:23.331143 n1    In  IP6 fc00:11:: > fc00:201:1::: RT6 (len=2, type=4, segleft=0, last-entry=0, tag=0, [0]fc00:201:1::) IP 10.255.100.1.7777 > 10.254.0.10.54676: Flags [.], ack 31, 
12:24:23.331147 hv1   Out IP6 fc00:11:: > fc00:201:1::: RT6 (len=2, type=4, segleft=0, last-entry=0, tag=0, [0]fc00:201:1::) IP 10.255.100.1.7777 > 10.254.0.10.54676: Flags [.], ack 31, 

===
SHELL# mikanectl hash bpftoolcli -t 17 -b fc00:12:1::11  | sudo sh -xe    // <-- set n2 is backend, n1 is previous-backend
===

12:24:40.696331 hv1   In  IP6 fc00:201:: > fc00:1:1::: RT6 (len=2, type=4, segleft=0, last-entry=0, tag=0, [0]fc00:1:1::) IP 10.254.0.10.54676 > 10.255.100.1.7777: Flags [P.], seq 31:44, ack 1, 
12:24:40.696364 l1    Out IP6 fc00:201:: > fc00:1:1::: RT6 (len=2, type=4, segleft=0, last-entry=0, tag=0, [0]fc00:1:1::) IP 10.254.0.10.54676 > 10.255.100.1.7777: Flags [P.], seq 31:44, ack 1, 
12:24:40.696394 l1    In  IP6 fc00:1:: > fc00:12:1::11: RT6 (len=2, type=4, segleft=0, last-entry=0, tag=0, [0]fc00:12:1::11) IP 10.254.0.10.54676 > 10.255.100.1.7777: Flags [P.], seq 31:44, ack 1, 
12:24:40.696402 n2    Out IP6 fc00:1:: > fc00:12:1::11: RT6 (len=2, type=4, segleft=0, last-entry=0, tag=0, [0]fc00:12:1::11) IP 10.254.0.10.54676 > 10.255.100.1.7777: Flags [P.], seq 31:44, ack 1, 
12:24:40.696412 n2    In  IP6 fc00:12:: > fc00:11:1::1: RT6 (len=2, type=4, segleft=0, last-entry=0, tag=0, [0]fc00:11:1::1) IP 10.254.0.10.54676 > 10.255.100.1.7777: Flags [P.], seq 31:44, ack 1, 
12:24:40.696417 n1    Out IP6 fc00:12:: > fc00:11:1::1: RT6 (len=2, type=4, segleft=0, last-entry=0, tag=0, [0]fc00:11:1::1) IP 10.254.0.10.54676 > 10.255.100.1.7777: Flags [P.], seq 31:44, ack 1, 
12:24:40.696455 n1    In  IP 10.254.0.10.54676 > 10.255.100.1.7777: Flags [P.], seq 31:44, ack 1, 
12:24:40.696463 c1    Out IP 10.254.0.10.54676 > 10.255.100.1.7777: Flags [P.], seq 31:44, ack 1, 

12:24:40.696477 c1    In  IP 10.255.100.1.7777 > 10.254.0.10.54676: Flags [.], ack 44, 
12:24:40.696487 l1    Out IP 10.255.100.1.7777 > 10.254.0.10.54676: Flags [.], ack 44, 
12:24:40.696495 l1    In  IP6 fc00:1:: > fc00:12:1::11: RT6 (len=2, type=4, segleft=0, last-entry=0, tag=0, [0]fc00:12:1::11) IP 10.255.100.1.7777 > 10.254.0.10.54676: Flags [.], ack 44, 
12:24:40.696498 n2    Out IP6 fc00:1:: > fc00:12:1::11: RT6 (len=2, type=4, segleft=0, last-entry=0, tag=0, [0]fc00:12:1::11) IP 10.255.100.1.7777 > 10.254.0.10.54676: Flags [.], ack 44, 
12:24:40.696506 n2    In  IP6 fc00:12:: > fc00:11:1::1: RT6 (len=2, type=4, segleft=0, last-entry=0, tag=0, [0]fc00:11:1::1) IP 10.255.100.1.7777 > 10.254.0.10.54676: Flags [.], ack 44, 
12:24:40.696508 n1    Out IP6 fc00:12:: > fc00:11:1::1: RT6 (len=2, type=4, segleft=0, last-entry=0, tag=0, [0]fc00:11:1::1) IP 10.255.100.1.7777 > 10.254.0.10.54676: Flags [.], ack 44, 
12:24:40.696518 n1    In  IP6 fc00:11:: > fc00:201:1::: RT6 (len=2, type=4, segleft=0, last-entry=0, tag=0, [0]fc00:201:1::) IP 10.255.100.1.7777 > 10.254.0.10.54676: Flags [.], ack 44, 
12:24:40.696521 hv1   Out IP6 fc00:11:: > fc00:201:1::: RT6 (len=2, type=4, segleft=0, last-entry=0, tag=0, [0]fc00:201:1::) IP 10.255.100.1.7777 > 10.254.0.10.54676: Flags [.], ack 44, 

12:24:46.241114 hv1   In  IP6 fc00:201:: > fc00:1:1::: RT6 (len=2, type=4, segleft=0, last-entry=0, tag=0, [0]fc00:1:1::) IP 10.254.0.10.54676 > 10.255.100.1.7777: Flags [P.], seq 44:56, ack 1, 
12:24:46.241127 l1    Out IP6 fc00:201:: > fc00:1:1::: RT6 (len=2, type=4, segleft=0, last-entry=0, tag=0, [0]fc00:1:1::) IP 10.254.0.10.54676 > 10.255.100.1.7777: Flags [P.], seq 44:56, ack 1, 
12:24:46.241157 l1    In  IP6 fc00:1:: > fc00:12:1::11: RT6 (len=2, type=4, segleft=0, last-entry=0, tag=0, [0]fc00:12:1::11) IP 10.254.0.10.54676 > 10.255.100.1.7777: Flags [P.], seq 44:56, ack 1, 
12:24:46.241163 n2    Out IP6 fc00:1:: > fc00:12:1::11: RT6 (len=2, type=4, segleft=0, last-entry=0, tag=0, [0]fc00:12:1::11) IP 10.254.0.10.54676 > 10.255.100.1.7777: Flags [P.], seq 44:56, ack 1, 
12:24:46.241177 n2    In  IP6 fc00:12:: > fc00:11:1::1: RT6 (len=2, type=4, segleft=0, last-entry=0, tag=0, [0]fc00:11:1::1) IP 10.254.0.10.54676 > 10.255.100.1.7777: Flags [P.], seq 44:56, ack 1, 
12:24:46.241184 n1    Out IP6 fc00:12:: > fc00:11:1::1: RT6 (len=2, type=4, segleft=0, last-entry=0, tag=0, [0]fc00:11:1::1) IP 10.254.0.10.54676 > 10.255.100.1.7777: Flags [P.], seq 44:56, ack 1, 
12:24:46.241219 n1    In  IP 10.254.0.10.54676 > 10.255.100.1.7777: Flags [P.], seq 44:56, ack 1, 
12:24:46.241227 c1    Out IP 10.254.0.10.54676 > 10.255.100.1.7777: Flags [P.], seq 44:56, ack 1, 

12:24:46.241240 c1    In  IP 10.255.100.1.7777 > 10.254.0.10.54676: Flags [.], ack 56, 
12:24:46.241253 l1    Out IP 10.255.100.1.7777 > 10.254.0.10.54676: Flags [.], ack 56, 
12:24:46.241269 l1    In  IP6 fc00:1:: > fc00:12:1::11: RT6 (len=2, type=4, segleft=0, last-entry=0, tag=0, [0]fc00:12:1::11) IP 10.255.100.1.7777 > 10.254.0.10.54676: Flags [.], ack 56, 
12:24:46.241271 n2    Out IP6 fc00:1:: > fc00:12:1::11: RT6 (len=2, type=4, segleft=0, last-entry=0, tag=0, [0]fc00:12:1::11) IP 10.255.100.1.7777 > 10.254.0.10.54676: Flags [.], ack 56, 
12:24:46.241284 n2    In  IP6 fc00:12:: > fc00:11:1::1: RT6 (len=2, type=4, segleft=0, last-entry=0, tag=0, [0]fc00:11:1::1) IP 10.255.100.1.7777 > 10.254.0.10.54676: Flags [.], ack 56, 
12:24:46.241286 n1    Out IP6 fc00:12:: > fc00:11:1::1: RT6 (len=2, type=4, segleft=0, last-entry=0, tag=0, [0]fc00:11:1::1) IP 10.255.100.1.7777 > 10.254.0.10.54676: Flags [.], ack 56, 
12:24:46.241298 n1    In  IP6 fc00:11:: > fc00:201:1::: RT6 (len=2, type=4, segleft=0, last-entry=0, tag=0, [0]fc00:201:1::) IP 10.255.100.1.7777 > 10.254.0.10.54676: Flags [.], ack 56, 
12:24:46.241302 hv1   Out IP6 fc00:11:: > fc00:201:1::: RT6 (len=2, type=4, segleft=0, last-entry=0, tag=0, [0]fc00:201:1::) IP 10.255.100.1.7777 > 10.254.0.10.54676: Flags [.], ack 56, 

===
(STOP NETCAT1)
===

12:24:53.126553 hv1   In  IP6 fc00:201:: > fc00:1:1::: RT6 (len=2, type=4, segleft=0, last-entry=0, tag=0, [0]fc00:1:1::) IP 10.254.0.10.54676 > 10.255.100.1.7777: Flags [F.], seq 56, ack 1, 
12:24:53.126568 l1    Out IP6 fc00:201:: > fc00:1:1::: RT6 (len=2, type=4, segleft=0, last-entry=0, tag=0, [0]fc00:1:1::) IP 10.254.0.10.54676 > 10.255.100.1.7777: Flags [F.], seq 56, ack 1, 
12:24:53.126594 l1    In  IP6 fc00:1:: > fc00:12:1::11: RT6 (len=2, type=4, segleft=0, last-entry=0, tag=0, [0]fc00:12:1::11) IP 10.254.0.10.54676 > 10.255.100.1.7777: Flags [F.], seq 56, ack 1, 
12:24:53.126599 n2    Out IP6 fc00:1:: > fc00:12:1::11: RT6 (len=2, type=4, segleft=0, last-entry=0, tag=0, [0]fc00:12:1::11) IP 10.254.0.10.54676 > 10.255.100.1.7777: Flags [F.], seq 56, ack 1, 
12:24:53.126610 n2    In  IP6 fc00:12:: > fc00:11:1::1: RT6 (len=2, type=4, segleft=0, last-entry=0, tag=0, [0]fc00:11:1::1) IP 10.254.0.10.54676 > 10.255.100.1.7777: Flags [F.], seq 56, ack 1, 
12:24:53.126615 n1    Out IP6 fc00:12:: > fc00:11:1::1: RT6 (len=2, type=4, segleft=0, last-entry=0, tag=0, [0]fc00:11:1::1) IP 10.254.0.10.54676 > 10.255.100.1.7777: Flags [F.], seq 56, ack 1, 
12:24:53.126649 n1    In  IP 10.254.0.10.54676 > 10.255.100.1.7777: Flags [F.], seq 56, ack 1, 
12:24:53.126657 c1    Out IP 10.254.0.10.54676 > 10.255.100.1.7777: Flags [F.], seq 56, ack 1, 

12:24:53.126723 c1    In  IP 10.255.100.1.7777 > 10.254.0.10.54676: Flags [F.], seq 1, ack 57, 
12:24:53.126729 l1    Out IP 10.255.100.1.7777 > 10.254.0.10.54676: Flags [F.], seq 1, ack 57, 
12:24:53.126751 l1    In  IP6 fc00:1:: > fc00:12:1::11: RT6 (len=2, type=4, segleft=0, last-entry=0, tag=0, [0]fc00:12:1::11) IP 10.255.100.1.7777 > 10.254.0.10.54676: Flags [F.], seq 1, ack 57, 
12:24:53.126756 n2    Out IP6 fc00:1:: > fc00:12:1::11: RT6 (len=2, type=4, segleft=0, last-entry=0, tag=0, [0]fc00:12:1::11) IP 10.255.100.1.7777 > 10.254.0.10.54676: Flags [F.], seq 1, ack 57, 
12:24:53.126764 n2    In  IP6 fc00:12:: > fc00:11:1::1: RT6 (len=2, type=4, segleft=0, last-entry=0, tag=0, [0]fc00:11:1::1) IP 10.255.100.1.7777 > 10.254.0.10.54676: Flags [F.], seq 1, ack 57, 
12:24:53.126766 n1    Out IP6 fc00:12:: > fc00:11:1::1: RT6 (len=2, type=4, segleft=0, last-entry=0, tag=0, [0]fc00:11:1::1) IP 10.255.100.1.7777 > 10.254.0.10.54676: Flags [F.], seq 1, ack 57, 
12:24:53.126781 n1    In  IP6 fc00:11:: > fc00:201:1::: RT6 (len=2, type=4, segleft=0, last-entry=0, tag=0, [0]fc00:201:1::) IP 10.255.100.1.7777 > 10.254.0.10.54676: Flags [F.], seq 1, ack 57, 
12:24:53.126785 hv1   Out IP6 fc00:11:: > fc00:201:1::: RT6 (len=2, type=4, segleft=0, last-entry=0, tag=0, [0]fc00:201:1::) IP 10.255.100.1.7777 > 10.254.0.10.54676: Flags [F.], seq 1, ack 57, 

12:24:53.126889 hv1   In  IP6 fc00:201:: > fc00:1:1::: RT6 (len=2, type=4, segleft=0, last-entry=0, tag=0, [0]fc00:1:1::) IP 10.254.0.10.54676 > 10.255.100.1.7777: Flags [.], ack 2, 
12:24:53.126892 l1    Out IP6 fc00:201:: > fc00:1:1::: RT6 (len=2, type=4, segleft=0, last-entry=0, tag=0, [0]fc00:1:1::) IP 10.254.0.10.54676 > 10.255.100.1.7777: Flags [.], ack 2, 
12:24:53.126908 l1    In  IP6 fc00:1:: > fc00:12:1::11: RT6 (len=2, type=4, segleft=0, last-entry=0, tag=0, [0]fc00:12:1::11) IP 10.254.0.10.54676 > 10.255.100.1.7777: Flags [.], ack 2, 
12:24:53.126910 n2    Out IP6 fc00:1:: > fc00:12:1::11: RT6 (len=2, type=4, segleft=0, last-entry=0, tag=0, [0]fc00:12:1::11) IP 10.254.0.10.54676 > 10.255.100.1.7777: Flags [.], ack 2, 
12:24:53.126919 n2    In  IP6 fc00:12:: > fc00:11:1::1: RT6 (len=2, type=4, segleft=0, last-entry=0, tag=0, [0]fc00:11:1::1) IP 10.254.0.10.54676 > 10.255.100.1.7777: Flags [.], ack 2, 
12:24:53.126921 n1    Out IP6 fc00:12:: > fc00:11:1::1: RT6 (len=2, type=4, segleft=0, last-entry=0, tag=0, [0]fc00:11:1::1) IP 10.254.0.10.54676 > 10.255.100.1.7777: Flags [.], ack 2, 
12:24:53.126932 n1    In  IP 10.254.0.10.54676 > 10.255.100.1.7777: Flags [.], ack 2, 
12:24:53.126935 c1    Out IP 10.254.0.10.54676 > 10.255.100.1.7777: Flags [.], ack 2, 

===
(START NETCAT2)
===

12:25:04.051422 hv1   In  IP6 fc00:201:: > fc00:1:1::: RT6 (len=2, type=4, segleft=0, last-entry=0, tag=0, [0]fc00:1:1::) IP 10.254.0.10.48418 > 10.255.100.1.7777: Flags [S], seq 824228831, 
12:25:04.051436 l1    Out IP6 fc00:201:: > fc00:1:1::: RT6 (len=2, type=4, segleft=0, last-entry=0, tag=0, [0]fc00:1:1::) IP 10.254.0.10.48418 > 10.255.100.1.7777: Flags [S], seq 824228831, 
12:25:04.051461 l1    In  IP6 fc00:1:: > fc00:12:1::11: RT6 (len=2, type=4, segleft=0, last-entry=0, tag=0, [0]fc00:12:1::11) IP 10.254.0.10.48418 > 10.255.100.1.7777: Flags [S], seq 824228831, 
12:25:04.051466 n2    Out IP6 fc00:1:: > fc00:12:1::11: RT6 (len=2, type=4, segleft=0, last-entry=0, tag=0, [0]fc00:12:1::11) IP 10.254.0.10.48418 > 10.255.100.1.7777: Flags [S], seq 824228831, 
12:25:04.051519 n2    In  IP 10.254.0.10.48418 > 10.255.100.1.7777: Flags [S], seq 824228831, 
12:25:04.051526 c1    Out IP 10.254.0.10.48418 > 10.255.100.1.7777: Flags [S], seq 824228831, 

12:25:04.051544 c1    In  IP 10.255.100.1.7777 > 10.254.0.10.48418: Flags [S.], seq 2516902141, ack 824228832, 
12:25:04.051547 l1    Out IP 10.255.100.1.7777 > 10.254.0.10.48418: Flags [S.], seq 2516902141, ack 824228832, 
12:25:04.051552 l1    In  IP6 fc00:1:: > fc00:12:1::11: RT6 (len=2, type=4, segleft=0, last-entry=0, tag=0, [0]fc00:12:1::11) IP 10.255.100.1.7777 > 10.254.0.10.48418: Flags [S.], seq 2516902141, ack 824228832, 
12:25:04.051570 n2    Out IP6 fc00:1:: > fc00:12:1::11: RT6 (len=2, type=4, segleft=0, last-entry=0, tag=0, [0]fc00:12:1::11) IP 10.255.100.1.7777 > 10.254.0.10.48418: Flags [S.], seq 2516902141, ack 824228832, 
12:25:04.051583 n2    In  IP6 fc00:12:: > fc00:201:1::: RT6 (len=2, type=4, segleft=0, last-entry=0, tag=0, [0]fc00:201:1::) IP 10.255.100.1.7777 > 10.254.0.10.48418: Flags [S.], seq 2516902141, ack 824228832, 
12:25:04.051587 hv1   Out IP6 fc00:12:: > fc00:201:1::: RT6 (len=2, type=4, segleft=0, last-entry=0, tag=0, [0]fc00:201:1::) IP 10.255.100.1.7777 > 10.254.0.10.48418: Flags [S.], seq 2516902141, ack 824228832, 

12:25:04.051633 hv1   In  IP6 fc00:201:: > fc00:1:1::: RT6 (len=2, type=4, segleft=0, last-entry=0, tag=0, [0]fc00:1:1::) IP 10.254.0.10.48418 > 10.255.100.1.7777: Flags [.], ack 1, 
12:25:04.051635 l1    Out IP6 fc00:201:: > fc00:1:1::: RT6 (len=2, type=4, segleft=0, last-entry=0, tag=0, [0]fc00:1:1::) IP 10.254.0.10.48418 > 10.255.100.1.7777: Flags [.], ack 1, 
12:25:04.051643 l1    In  IP6 fc00:1:: > fc00:12:1::11: RT6 (len=2, type=4, segleft=0, last-entry=0, tag=0, [0]fc00:12:1::11) IP 10.254.0.10.48418 > 10.255.100.1.7777: Flags [.], ack 1, 
12:25:04.051645 n2    Out IP6 fc00:1:: > fc00:12:1::11: RT6 (len=2, type=4, segleft=0, last-entry=0, tag=0, [0]fc00:12:1::11) IP 10.254.0.10.48418 > 10.255.100.1.7777: Flags [.], ack 1, 
12:25:04.051656 n2    In  IP 10.254.0.10.48418 > 10.255.100.1.7777: Flags [.], ack 1, 
12:25:04.051658 c1    Out IP 10.254.0.10.48418 > 10.255.100.1.7777: Flags [.], ack 1, 

12:25:08.134113 hv1   In  IP6 fc00:201:: > fc00:1:1::: RT6 (len=2, type=4, segleft=0, last-entry=0, tag=0, [0]fc00:1:1::) IP 10.254.0.10.48418 > 10.255.100.1.7777: Flags [P.], seq 1:14, ack 1, 
12:25:08.134126 l1    Out IP6 fc00:201:: > fc00:1:1::: RT6 (len=2, type=4, segleft=0, last-entry=0, tag=0, [0]fc00:1:1::) IP 10.254.0.10.48418 > 10.255.100.1.7777: Flags [P.], seq 1:14, ack 1, 
12:25:08.134151 l1    In  IP6 fc00:1:: > fc00:12:1::11: RT6 (len=2, type=4, segleft=0, last-entry=0, tag=0, [0]fc00:12:1::11) IP 10.254.0.10.48418 > 10.255.100.1.7777: Flags [P.], seq 1:14, ack 1, 
12:25:08.134155 n2    Out IP6 fc00:1:: > fc00:12:1::11: RT6 (len=2, type=4, segleft=0, last-entry=0, tag=0, [0]fc00:12:1::11) IP 10.254.0.10.48418 > 10.255.100.1.7777: Flags [P.], seq 1:14, ack 1, 
12:25:08.134187 n2    In  IP 10.254.0.10.48418 > 10.255.100.1.7777: Flags [P.], seq 1:14, ack 1, 
12:25:08.134195 c1    Out IP 10.254.0.10.48418 > 10.255.100.1.7777: Flags [P.], seq 1:14, ack 1, 

12:25:08.134210 c1    In  IP 10.255.100.1.7777 > 10.254.0.10.48418: Flags [.], ack 14, 
12:25:08.134213 l1    Out IP 10.255.100.1.7777 > 10.254.0.10.48418: Flags [.], ack 14, 
12:25:08.134218 l1    In  IP6 fc00:1:: > fc00:12:1::11: RT6 (len=2, type=4, segleft=0, last-entry=0, tag=0, [0]fc00:12:1::11) IP 10.255.100.1.7777 > 10.254.0.10.48418: Flags [.], ack 14, 
12:25:08.134219 n2    Out IP6 fc00:1:: > fc00:12:1::11: RT6 (len=2, type=4, segleft=0, last-entry=0, tag=0, [0]fc00:12:1::11) IP 10.255.100.1.7777 > 10.254.0.10.48418: Flags [.], ack 14, 
12:25:08.134229 n2    In  IP6 fc00:12:: > fc00:201:1::: RT6 (len=2, type=4, segleft=0, last-entry=0, tag=0, [0]fc00:201:1::) IP 10.255.100.1.7777 > 10.254.0.10.48418: Flags [.], ack 14, 
12:25:08.134235 hv1   Out IP6 fc00:12:: > fc00:201:1::: RT6 (len=2, type=4, segleft=0, last-entry=0, tag=0, [0]fc00:201:1::) IP 10.255.100.1.7777 > 10.254.0.10.48418: Flags [.], ack 14, 

12:25:12.055501 hv1   In  IP6 fc00:201:: > fc00:1:1::: RT6 (len=2, type=4, segleft=0, last-entry=0, tag=0, [0]fc00:1:1::) IP 10.254.0.10.48418 > 10.255.100.1.7777: Flags [P.], seq 14:36, ack 1, 
12:25:12.055513 l1    Out IP6 fc00:201:: > fc00:1:1::: RT6 (len=2, type=4, segleft=0, last-entry=0, tag=0, [0]fc00:1:1::) IP 10.254.0.10.48418 > 10.255.100.1.7777: Flags [P.], seq 14:36, ack 1, 
12:25:12.055536 l1    In  IP6 fc00:1:: > fc00:12:1::11: RT6 (len=2, type=4, segleft=0, last-entry=0, tag=0, [0]fc00:12:1::11) IP 10.254.0.10.48418 > 10.255.100.1.7777: Flags [P.], seq 14:36, ack 1, 
12:25:12.055541 n2    Out IP6 fc00:1:: > fc00:12:1::11: RT6 (len=2, type=4, segleft=0, last-entry=0, tag=0, [0]fc00:12:1::11) IP 10.254.0.10.48418 > 10.255.100.1.7777: Flags [P.], seq 14:36, ack 1, 
12:25:12.055688 n2    In  IP 10.254.0.10.48418 > 10.255.100.1.7777: Flags [P.], seq 14:36, ack 1, 
12:25:12.055701 c1    Out IP 10.254.0.10.48418 > 10.255.100.1.7777: Flags [P.], seq 14:36, ack 1, 

12:25:12.055718 c1    In  IP 10.255.100.1.7777 > 10.254.0.10.48418: Flags [.], ack 36, 
12:25:12.055738 l1    Out IP 10.255.100.1.7777 > 10.254.0.10.48418: Flags [.], ack 36, 
12:25:12.055762 l1    In  IP6 fc00:1:: > fc00:12:1::11: RT6 (len=2, type=4, segleft=0, last-entry=0, tag=0, [0]fc00:12:1::11) IP 10.255.100.1.7777 > 10.254.0.10.48418: Flags [.], ack 36, 
12:25:12.055770 n2    Out IP6 fc00:1:: > fc00:12:1::11: RT6 (len=2, type=4, segleft=0, last-entry=0, tag=0, [0]fc00:12:1::11) IP 10.255.100.1.7777 > 10.254.0.10.48418: Flags [.], ack 36, 
12:25:12.055789 n2    In  IP6 fc00:12:: > fc00:201:1::: RT6 (len=2, type=4, segleft=0, last-entry=0, tag=0, [0]fc00:201:1::) IP 10.255.100.1.7777 > 10.254.0.10.48418: Flags [.], ack 36, 
12:25:12.055794 hv1   Out IP6 fc00:12:: > fc00:201:1::: RT6 (len=2, type=4, segleft=0, last-entry=0, tag=0, [0]fc00:201:1::) IP 10.255.100.1.7777 > 10.254.0.10.48418: Flags [.], ack 36, 
